{
  "availableModes": [
    "count",
    "share"
  ],
  "categoryId": "fixture-category",
  "count": {
    "deviation": null,
    "deviationUnit": "brands",
    "focusValue": null,
    "peerMedian": null,
    "peerValues": []
  },
  "defaultMode": "count",
  "focusExcludedFromMedian": true,
  "focusObjectId": "focus",
  "payloadId": "category-benchmark:F141_016_tie_break",
  "payloadVersion": "1.0.0",
  "peerObjectIds": [],
  "provenance": {
    "rawInputSha256": "5ce8e9d529d618fbbf62391505c3ebfb96b3d40c4885c9da64513b889df819fb",
    "sourceFixtureId": "F141_016_tie_break"
  },
  "quality": {
    "limitations": [],
    "state": "confirmed"
  },
  "share": {
    "deviation": null,
    "deviationUnit": "percentage_points",
    "focusShareExact": null,
    "peerMedianShareExact": null,
    "peerSharesExact": [],
    "shareExactDelta": null
  },
  "state": "ok"
}
