{
  "availableModes": [
    "count",
    "share"
  ],
  "categoryId": "fixture-category",
  "count": {
    "deviation": null,
    "deviationUnit": "brands",
    "focusValue": null,
    "peerMedian": null,
    "peerValues": []
  },
  "defaultMode": "count",
  "focusExcludedFromMedian": true,
  "focusObjectId": "focus",
  "payloadId": "category-benchmark:F141_011_no_data",
  "payloadVersion": "1.0.0",
  "peerObjectIds": [],
  "provenance": {
    "rawInputSha256": "e36b9e2307397993f8394fb5de21e290133349b3a6ca58108be2a0a51f7baf6a",
    "sourceFixtureId": "F141_011_no_data"
  },
  "quality": {
    "limitations": [],
    "state": "no_data"
  },
  "share": {
    "deviation": null,
    "deviationUnit": "percentage_points",
    "focusShareExact": null,
    "peerMedianShareExact": null,
    "peerSharesExact": [],
    "shareExactDelta": null
  },
  "state": "no_data"
}
