{
  "availableModes": [
    "count",
    "share"
  ],
  "categoryId": "fixture-category",
  "count": {
    "deviation": -10,
    "deviationUnit": "brands",
    "focusValue": 0,
    "peerMedian": 10,
    "peerValues": [
      5,
      10,
      15
    ]
  },
  "defaultMode": "count",
  "focusExcludedFromMedian": true,
  "focusObjectId": "focus",
  "payloadId": "category-benchmark:F141_006_focus_zero",
  "payloadVersion": "1.0.0",
  "peerObjectIds": [
    "peer-1",
    "peer-2",
    "peer-3"
  ],
  "provenance": {
    "rawInputSha256": "4ff369f69bf8faef265a8fed66c8a56eb3d7bd35e79a8c7d37c739be6c53f898",
    "sourceFixtureId": "F141_006_focus_zero"
  },
  "quality": {
    "limitations": [],
    "state": "confirmed"
  },
  "share": {
    "deviation": null,
    "deviationUnit": "percentage_points",
    "focusShareExact": null,
    "peerMedianShareExact": null,
    "peerSharesExact": [],
    "shareExactDelta": null
  },
  "state": "ok"
}
