{
  "availableModes": [
    "count",
    "share"
  ],
  "categoryId": "fixture-category",
  "count": {
    "deviation": 5,
    "deviationUnit": "brands",
    "focusValue": 5,
    "peerMedian": 0,
    "peerValues": [
      0,
      0,
      10
    ]
  },
  "defaultMode": "count",
  "focusExcludedFromMedian": true,
  "focusObjectId": "focus",
  "payloadId": "category-benchmark:F141_007_median_zero",
  "payloadVersion": "1.0.0",
  "peerObjectIds": [
    "peer-1",
    "peer-2",
    "peer-3"
  ],
  "provenance": {
    "rawInputSha256": "36906891a572309ebbcd7d8fb732262d77dc1eb94bfac2dd5a6301d052da6e94",
    "sourceFixtureId": "F141_007_median_zero"
  },
  "quality": {
    "limitations": [],
    "state": "confirmed"
  },
  "share": {
    "deviation": null,
    "deviationUnit": "percentage_points",
    "focusShareExact": null,
    "peerMedianShareExact": null,
    "peerSharesExact": [],
    "shareExactDelta": null
  },
  "state": "ok"
}
