{
  "availableModes": [
    "count",
    "share"
  ],
  "categoryId": "fixture-category",
  "count": {
    "deviation": null,
    "deviationUnit": "brands",
    "focusValue": null,
    "peerMedian": 12.0,
    "peerValues": [
      10,
      14
    ]
  },
  "defaultMode": "count",
  "focusExcludedFromMedian": true,
  "focusObjectId": "focus",
  "payloadId": "category-benchmark:F141_013_all_quality_excluded",
  "payloadVersion": "1.0.0",
  "peerObjectIds": [
    "peer-1",
    "peer-2"
  ],
  "provenance": {
    "rawInputSha256": "d9d6c35cf0b2fd2f2e36d5849a7dde0c353a53dc47f63038231e2e6effaeaec1",
    "sourceFixtureId": "F141_013_all_quality_excluded"
  },
  "quality": {
    "limitations": [],
    "state": "quality_excluded"
  },
  "share": {
    "deviation": null,
    "deviationUnit": "percentage_points",
    "focusShareExact": null,
    "peerMedianShareExact": null,
    "peerSharesExact": [],
    "shareExactDelta": null
  },
  "state": "quality_excluded"
}
